{
  "protocol_version": "0.1.0",
  "id": "openai.responses.stream.text-tool",
  "title": "Responses SSE text and tool-call lifecycle normalizes and encodes for Chat",
  "synthetic": true,
  "source_profile": "openai.responses.alpha-0.1.0",
  "target_profile": "openai.chat-completions.alpha-0.1.0",
  "kind": "cross_profile_conversion",
  "input": {
    "envelope": {
      "profile_id": "openai.responses.alpha-0.1.0",
      "status": 200,
      "body_kind": "sse",
      "protocol_headers": [
        {
          "raw_line": "content-type: text/event-stream"
        }
      ],
      "body_base64": "ZXZlbnQ6IHJlc3BvbnNlLmNyZWF0ZWQKZGF0YTogeyJ0eXBlIjoicmVzcG9uc2UuY3JlYXRlZCIsInJlc3BvbnNlIjp7ImlkIjoicmVzcF9zeW50aGV0aWMiLCJzdGF0dXMiOiJpbl9wcm9ncmVzcyIsIm91dHB1dCI6W119fQoKZXZlbnQ6IHJlc3BvbnNlLm91dHB1dF9pdGVtLmFkZGVkCmRhdGE6IHsidHlwZSI6InJlc3BvbnNlLm91dHB1dF9pdGVtLmFkZGVkIiwib3V0cHV0X2luZGV4IjowLCJpdGVtIjp7ImlkIjoibXNnX3N5bnRoZXRpYyIsInR5cGUiOiJtZXNzYWdlIiwic3RhdHVzIjoiaW5fcHJvZ3MiLCJyb2xlIjoiYXNzaXN0YW50IiwiY29udGVudCI6W119fQoKZXZlbnQ6IHJlc3BvbnNlLmNvbnRlbnRfcGFydC5hZGRlZApkYXRhOiB7InR5cGUiOiJyZXNwb25zZS5jb250ZW50X3BhcnQuYWRkZWQiLCJpdGVtX2lkIjoibXNnX3N5bnRoZXRpYyIsIm91dHB1dF9pbmRleCI6MCwiY29udGVudF9pbmRleCI6MCwicGFydCI6eyJ0eXBlIjoib3V0cHV0X3RleHQiLCJ0ZXh0IjoiIiwiYW5ub3RhdGlvbnMiOltdfX0KCmV2ZW50OiByZXNwb25zZS5vdXRwdXRfdGV4dC5kZWx0YQpkYXRhOiB7InR5cGUiOiJyZXNwb25zZS5vdXRwdXRfdGV4dC5kZWx0YSIsIml0ZW1faWQiOiJtc2dfc3ludGhldGljIiwib3V0cHV0X2luZGV4IjowLCJjb250ZW50X2luZGV4IjowLCJkZWx0YSI6InN5bnRoZXRpYyByZXBseSJ9CgpldmVudDogcmVzcG9uc2UuZnVuY3Rpb25fY2FsbF9hcmd1bWVudHMuZGVsdGEKZGF0YTogeyJ0eXBlIjoicmVzcG9uc2UuZnVuY3Rpb25fY2FsbF9hcmd1bWVudHMuZGVsdGEiLCJpdGVtX2lkIjoiY2FsbF9zeW50aGV0aWMiLCJjYWxsX2lkIjoiY2FsbF9zeW50aGV0aWMiLCJvdXRwdXRfaW5kZXgiOjEsImRlbHRhIjoie1wic3ViamVjdFwiOlwiYWxwaGFcIn0ifQoKZXZlbnQ6IHJlc3BvbnNlLmNvbXBsZXRlZApkYXRhOiB7InR5cGUiOiJyZXNwb25zZS5jb21wbGV0ZWQiLCJyZXNwb25zZSI6eyJpZCI6InJlc3Bfc3ludGhldGljIiwic3RhdHVzIjoiY29tcGxldGVkIiwidXNhZ2UiOnsiaW5wdXRfdG9rZW5zIjoxMSwib3V0cHV0X3Rva2VucyI6NywidG90YWxfdG9rZW5zIjoxOH0sIm91dHB1dCI6W119fQoK"
    }
  },
  "expect": {
    "fidelity": "exact",
    "diagnostic_codes": []
  }
}
