{
  "protocol_version": "0.1.0",
  "id": "openai.responses.request.to-messages",
  "title": "Synthetic Responses request encoded through the shared IR to Messages",
  "synthetic": true,
  "source_profile": "openai.responses.alpha-0.1.0",
  "target_profile": "anthropic.messages.2023-06-01.alpha-0.1.0",
  "kind": "cross_profile_conversion",
  "input": {
    "envelope": {
      "profile_id": "openai.responses.alpha-0.1.0",
      "status": 200,
      "body_kind": "json",
      "protocol_headers": [
        {
          "raw_line": "content-type: application/json"
        }
      ],
      "body_base64": "eyJtb2RlbCI6InN5bnRoZXRpYy1tb2RlbCIsImlucHV0IjpbeyJyb2xlIjoidXNlciIsImNvbnRlbnQiOlt7InR5cGUiOiJpbnB1dF90ZXh0IiwidGV4dCI6InN5bnRoZXRpYyByZXF1ZXN0In1dfSx7InR5cGUiOiJmdW5jdGlvbl9jYWxsIiwiY2FsbF9pZCI6ImNhbGxfc3ludGhldGljIiwibmFtZSI6InN5bnRoZXRpY19sb29rdXAiLCJhcmd1bWVudHMiOiJ7XCJzdWJqZWN0XCI6XCJhbHBoYVwifSJ9LHsidHlwZSI6ImZ1bmN0aW9uX2NhbGxfb3V0cHV0IiwiY2FsbF9pZCI6ImNhbGxfc3ludGhldGljIiwib3V0cHV0Ijoic3ludGhldGljIHJlc3VsdCJ9XSwibWF4X291dHB1dF90b2tlbnMiOjI0fQ=="
    }
  },
  "expect": {
    "fidelity": "exact",
    "diagnostic_codes": []
  }
}
