{
  "protocol_version": "0.1.0",
  "id": "anthropic.messages.stream.replay.unmodified",
  "title": "Synthetic Messages SSE exact replay",
  "synthetic": true,
  "source_profile": "anthropic.messages.2023-06-01.alpha-0.1.0",
  "target_profile": "anthropic.messages.2023-06-01.alpha-0.1.0",
  "kind": "exact_replay",
  "input": {
    "envelope": {
      "profile_id": "anthropic.messages.2023-06-01.alpha-0.1.0",
      "status": 200,
      "body_kind": "sse",
      "protocol_headers": [
        {
          "raw_line": "Content-Type: text/event-stream"
        },
        {
          "raw_line": "Anthropic-Version: 2023-06-01"
        },
        {
          "raw_line": "anthropic-beta: synthetic-stream-beta"
        }
      ],
      "body_base64": "ZXZlbnQ6IG1lc3NhZ2Vfc3RhcnQKZGF0YTogeyJ0eXBlIjoibWVzc2FnZV9zdGFydCIsIm1lc3NhZ2UiOnsiaWQiOiJtc2dfc3ludGhldGljIiwidHlwZSI6Im1lc3NhZ2UiLCJyb2xlIjoiYXNzaXN0YW50IiwiY29udGVudCI6W10sIm1vZGVsIjoic3ludGhldGljLW1vZGVsIiwidXNhZ2UiOnsiaW5wdXRfdG9rZW5zIjoxMSwib3V0cHV0X3Rva2VucyI6MH19fQoKZXZlbnQ6IGNvbnRlbnRfYmxvY2tfc3RhcnQKZGF0YTogeyJ0eXBlIjoiY29udGVudF9ibG9ja19zdGFydCIsImluZGV4IjowLCJjb250ZW50X2Jsb2NrIjp7InR5cGUiOiJ0ZXh0IiwidGV4dCI6IiJ9fQoKZXZlbnQ6IGNvbnRlbnRfYmxvY2tfZGVsdGEKZGF0YTogeyJ0eXBlIjoiY29udGVudF9ibG9ja19kZWx0YSIsImluZGV4IjowLCJkZWx0YSI6eyJ0eXBlIjoidGV4dF9kZWx0YSIsInRleHQiOiJzeW50aGV0aWMgcmVwbHkifX0KCmV2ZW50OiBjb250ZW50X2Jsb2NrX3N0b3AKZGF0YTogeyJ0eXBlIjoiY29udGVudF9ibG9ja19zdG9wIiwiaW5kZXgiOjB9CgpldmVudDogY29udGVudF9ibG9ja19zdGFydApkYXRhOiB7InR5cGUiOiJjb250ZW50X2Jsb2NrX3N0YXJ0IiwiaW5kZXgiOjEsImNvbnRlbnRfYmxvY2siOnsidHlwZSI6InRvb2xfdXNlIiwiaWQiOiJjYWxsX3N5bnRoZXRpYyIsIm5hbWUiOiJzeW50aGV0aWNfbG9va3VwIiwiaW5wdXQiOnt9fX0KCmV2ZW50OiBjb250ZW50X2Jsb2NrX2RlbHRhCmRhdGE6IHsidHlwZSI6ImNvbnRlbnRfYmxvY2tfZGVsdGEiLCJpbmRleCI6MSwiZGVsdGEiOnsidHlwZSI6ImlucHV0X2pzb25fZGVsdGEiLCJwYXJ0aWFsX2pzb24iOiJ7XCJzdWJqZWN0XCI6XCJhbHBoYVwifSJ9fQoKZXZlbnQ6IGNvbnRlbnRfYmxvY2tfc3RvcApkYXRhOiB7InR5cGUiOiJjb250ZW50X2Jsb2NrX3N0b3AiLCJpbmRleCI6MX0KCmV2ZW50OiBtZXNzYWdlX2RlbHRhCmRhdGE6IHsidHlwZSI6Im1lc3NhZ2VfZGVsdGEiLCJkZWx0YSI6eyJzdG9wX3JlYXNvbiI6InRvb2xfdXNlIn0sInVzYWdlIjp7ImlucHV0X3Rva2VucyI6MTEsIm91dHB1dF90b2tlbnMiOjd9fQoKZXZlbnQ6IG1lc3NhZ2Vfc3RvcApkYXRhOiB7InR5cGUiOiJtZXNzYWdlX3N0b3AifQoK"
    }
  },
  "expect": {
    "fidelity": "exact",
    "diagnostic_codes": [],
    "exact_replay": {
      "protocol_headers": [
        "Content-Type: text/event-stream",
        "Anthropic-Version: 2023-06-01",
        "anthropic-beta: synthetic-stream-beta"
      ],
      "body_base64": "ZXZlbnQ6IG1lc3NhZ2Vfc3RhcnQKZGF0YTogeyJ0eXBlIjoibWVzc2FnZV9zdGFydCIsIm1lc3NhZ2UiOnsiaWQiOiJtc2dfc3ludGhldGljIiwidHlwZSI6Im1lc3NhZ2UiLCJyb2xlIjoiYXNzaXN0YW50IiwiY29udGVudCI6W10sIm1vZGVsIjoic3ludGhldGljLW1vZGVsIiwidXNhZ2UiOnsiaW5wdXRfdG9rZW5zIjoxMSwib3V0cHV0X3Rva2VucyI6MH19fQoKZXZlbnQ6IGNvbnRlbnRfYmxvY2tfc3RhcnQKZGF0YTogeyJ0eXBlIjoiY29udGVudF9ibG9ja19zdGFydCIsImluZGV4IjowLCJjb250ZW50X2Jsb2NrIjp7InR5cGUiOiJ0ZXh0IiwidGV4dCI6IiJ9fQoKZXZlbnQ6IGNvbnRlbnRfYmxvY2tfZGVsdGEKZGF0YTogeyJ0eXBlIjoiY29udGVudF9ibG9ja19kZWx0YSIsImluZGV4IjowLCJkZWx0YSI6eyJ0eXBlIjoidGV4dF9kZWx0YSIsInRleHQiOiJzeW50aGV0aWMgcmVwbHkifX0KCmV2ZW50OiBjb250ZW50X2Jsb2NrX3N0b3AKZGF0YTogeyJ0eXBlIjoiY29udGVudF9ibG9ja19zdG9wIiwiaW5kZXgiOjB9CgpldmVudDogY29udGVudF9ibG9ja19zdGFydApkYXRhOiB7InR5cGUiOiJjb250ZW50X2Jsb2NrX3N0YXJ0IiwiaW5kZXgiOjEsImNvbnRlbnRfYmxvY2siOnsidHlwZSI6InRvb2xfdXNlIiwiaWQiOiJjYWxsX3N5bnRoZXRpYyIsIm5hbWUiOiJzeW50aGV0aWNfbG9va3VwIiwiaW5wdXQiOnt9fX0KCmV2ZW50OiBjb250ZW50X2Jsb2NrX2RlbHRhCmRhdGE6IHsidHlwZSI6ImNvbnRlbnRfYmxvY2tfZGVsdGEiLCJpbmRleCI6MSwiZGVsdGEiOnsidHlwZSI6ImlucHV0X2pzb25fZGVsdGEiLCJwYXJ0aWFsX2pzb24iOiJ7XCJzdWJqZWN0XCI6XCJhbHBoYVwifSJ9fQoKZXZlbnQ6IGNvbnRlbnRfYmxvY2tfc3RvcApkYXRhOiB7InR5cGUiOiJjb250ZW50X2Jsb2NrX3N0b3AiLCJpbmRleCI6MX0KCmV2ZW50OiBtZXNzYWdlX2RlbHRhCmRhdGE6IHsidHlwZSI6Im1lc3NhZ2VfZGVsdGEiLCJkZWx0YSI6eyJzdG9wX3JlYXNvbiI6InRvb2xfdXNlIn0sInVzYWdlIjp7ImlucHV0X3Rva2VucyI6MTEsIm91dHB1dF90b2tlbnMiOjd9fQoKZXZlbnQ6IG1lc3NhZ2Vfc3RvcApkYXRhOiB7InR5cGUiOiJtZXNzYWdlX3N0b3AifQoK"
    }
  }
}
